vendorId,companyName,primaryContactName,primaryContactEmail,phoneNumber,address,category,engagementStatus,registrationDate,lastInteractionDate,performanceRating,contractEndDate,notes
V1320,Wilson Ltd,Brian Reed,wilson.ltd5@example.com,001-454-562-6998x71471,"60760 Evans Way Suite 649, Anthonytown, IA 63500",Manufacturing Equipment,COMPLETED_ONBOARDED,2025-10-11,2025-01-23T18:13:31.348596,3.4,2026-11-12,Rise agreement play body economy protect amount audience recognize issue control common deep light during eye rule memory chair.
V1321,"Byrd, Davies and Miles",Joshua Cochran,byrd.davies.and.miles47@example.com,(948)486-1898,"50429 Christina Harbors Suite 618, Millerborough, GU 60181",Packaging Solutions,COMPLETED_ONBOARDED,2025-07-03,2025-10-20T18:13:31.348905,3.9,2026-09-10,Republican see wonder sit well arrive health news in.
V1322,Bass-Rivera,Nicole Holder,bass-rivera23@example.com,981.303.3799,"516 Griffin Inlet Apt. 408, New Paulland, IL 83715",Raw Materials (Produce),OPEN_IN_PROGRESS,2024-04-22,2025-07-01T18:13:31.349177,4.5,2027-05-02,Democratic spring environment reflect will against look another million fill.
V1323,"Martin, Smith and Walters",Amanda Armstrong,martin.smith.and.walters3@example.com,+1-292-357-3323x661,"6027 Christopher Turnpike Apt. 748, East Wesleyberg, GU 09769",Ingredients & Additives,YET_TO_RESPOND,2024-01-05,2025-04-01T18:13:31.349479,1.8,2026-04-05,Decide statement treat talk gun job security appear read break spend office entire.
V1324,"Moses, Cooper and Hester",Thomas Moore,moses.cooper.and.hester33@example.com,(959)201-8205x9454,"29409 Benjamin Greens, Maloneburgh, ID 34765",IT Services,COMPLETED_ONBOARDED,2023-04-15,2025-02-16T18:13:31.349848,2.1,2027-05-10,Tough involve same far word radio want phone these two tree effect number.
V1325,Burnett Ltd,Aaron Green,burnett.ltd19@example.com,441.626.7299,"913 Larry Knolls, Jamesfort, CA 62593",Marketing & Advertising,OPEN_IN_PROGRESS,2025-03-29,2024-10-27T18:13:31.350090,1.5,2026-10-03,Send remember follow address behind notice indicate religious analysis return thing interesting parent how itself great system.
V1326,Palmer-Howard,Alexander Wilson,palmer-howard27@example.com,979-819-9389x81070,"27817 Scott Well Apt. 835, Jenniferville, MH 46645",Ingredients & Additives,COMPLETED_ONBOARDED,2025-10-12,2024-10-29T18:13:31.350376,1.9,2027-04-29,Base pattern can necessary night against off nation site production certain agreement low worker over though author amount.
V1327,"Diaz, Holt and Jones",Deborah Strickland,diaz.holt.and.jones8@example.com,8539756173,"44039 Kerr Well Apt. 422, Lake Steven, VI 59642",Ingredients & Additives,OPEN_IN_PROGRESS,2025-01-10,2025-03-19T18:13:31.350692,3.4,2026-05-23,Majority whatever others spring friend president home fly difficult away dark who forward conference whether.
V1328,Carpenter Group,Amanda Lopez,carpenter.group45@example.com,+1-369-443-1199x6614,"055 Romero Forks, Aliciaborough, NV 79172",Ingredients & Additives,COMPLETED_ONBOARDED,2023-05-18,2025-05-07T18:13:31.350934,3.0,2026-01-15,Everybody deal surface contain effort democratic pressure put seat available herself.
V1329,"Pena, Spencer and Miller",Angel Brown,pena.spencer.and.miller38@example.com,(647)434-9339,"03555 Harris View Apt. 225, West Carlosburgh, IA 58138",Logistics & Distribution,YET_TO_RESPOND,2023-06-13,2025-09-20T18:13:31.351249,1.8,2026-12-07,Window finish energy myself lose resource benefit prevent business old a nature although same effort include future treatment leave.
V1330,Price-Simpson,Stephanie Fischer,price-simpson23@example.com,+1-618-320-0217x5896,"637 Ellis Ports, South Brooke, AS 46653",Ingredients & Additives,YET_TO_RESPOND,2025-09-24,2025-02-25T18:13:31.351530,1.5,2026-12-05,Game bank share develop memory million serious address use school watch room now item finally impact final.
V1331,Johnson Inc,Terri Watson,johnson.inc19@example.com,677.835.5793x045,"04517 Yates Valley, Stevensville, HI 31368",Raw Materials (Produce),YET_TO_RESPOND,2025-01-28,2025-03-13T18:13:31.351778,3.5,2027-08-08,Tough work customer goal star against the range window bill exactly enjoy responsibility common meet agreement half.
V1332,Davis-Fields,Tiffany Olson,davis-fields30@example.com,(818)307-4299x6801,"956 Anthony Row, Summersstad, MD 39155",Ingredients & Additives,COMPLETED_ONBOARDED,2024-01-05,2025-10-03T18:13:31.352047,1.4,2027-03-21,Single behavior who my but positive forget country eat might.
V1333,Mcdowell Inc,Andrew Morgan,mcdowell.inc9@example.com,(853)874-3942,"PSC 5131, Box 2780, APO AP 13391",Marketing & Advertising,YET_TO_RESPOND,2024-12-04,2025-08-12T18:13:31.352210,2.3,2027-09-06,Military military degree Republican write future again analysis together coach too point series standard myself.
V1334,Thompson and Sons,Derek Morgan,thompson.and.sons36@example.com,889-681-3120x5332,"7744 Sarah Ville, Davidview, WA 24180",Packaging Solutions,COMPLETED_ONBOARDED,2022-12-06,2025-02-18T18:13:31.352434,3.2,2027-05-31,Organization any heavy their way kid network ground thousand story later seat whole team size off thank opportunity education do.
V1335,Coffey-Green,Melissa Anderson,coffey-green1@example.com,252-273-6677x062,"83247 Tanya Street, Melanieland, NH 92411",IT Services,COMPLETED_ONBOARDED,2023-12-02,2025-06-09T18:13:31.352686,2.1,2027-06-04,Manage old eye leg majority present free interesting per stuff house thought.
V1336,Davis Inc,Michael Matthews,davis.inc45@example.com,001-614-281-3553x005,"Unit 3689 Box 6785, DPO AA 90823",Logistics & Distribution,YET_TO_RESPOND,2025-08-19,2025-04-18T18:13:31.352845,4.8,2026-01-30,Cut identify know finish security particularly agree quickly open customer ground particularly benefit gas sing.
V1337,"Diaz, Flores and Alexander",Michael Savage,diaz.flores.and.alexander46@example.com,203.371.1175x713,"30141 Richmond Views Apt. 075, East Sydney, PW 22882",Logistics & Distribution,COMPLETED_ONBOARDED,2024-06-24,2025-01-13T18:13:31.353148,1.7,2027-03-24,Market friend beyond least lot leg matter up trouble participant rise space language scientist part knowledge painting sell Mrs then.
V1338,Clark PLC,Becky Bradley,clark.plc1@example.com,8376278102,"USS Woods, FPO AP 70668",Packaging Solutions,YET_TO_RESPOND,2023-01-20,2025-05-30T18:13:31.353336,5.0,2027-08-29,Scene I society oil lay style believe none experience child fund statement evidence page major the deal line.
V1339,Thomas-Mcconnell,Gregory Oconnell,thomas-mcconnell41@example.com,+1-252-754-6195x878,"9954 Brian Extension, West Victor, MD 43218",Ingredients & Additives,OPEN_IN_PROGRESS,2023-08-16,2024-12-19T18:13:31.353591,4.5,2026-04-29,Participant project dinner plan charge laugh argue tonight my my production color pressure event yard wear bed claim item.
V1340,Smith LLC,Renee Deleon,smith.llc48@example.com,445.244.8311,"51927 Stacey Unions Suite 928, Williamsport, IL 07343",Ingredients & Additives,OPEN_IN_PROGRESS,2025-09-04,2025-03-06T18:13:31.353824,1.4,2027-08-15,Hand officer along meeting century area main mouth cold you.
V1341,Lee-Mejia,Brian Huffman,lee-mejia36@example.com,456-651-1844x282,"3457 Francis Shoal, Floresview, ND 06375",IT Services,COMPLETED_ONBOARDED,2025-01-08,2025-03-13T18:13:31.354084,4.6,2027-02-01,Such weight before purpose free for policy poor use serious wish begin today.
V1342,"Wells, Murphy and Buck",Jeremy Walker,wells.murphy.and.buck48@example.com,916-968-8931,"6206 Christopher Freeway, North Tristan, NE 58702",IT Services,COMPLETED_ONBOARDED,2023-08-19,2025-07-04T18:13:31.354367,2.3,2026-12-04,Option serious rock article dinner amount should not interest later parent threat as truth away low know.
V1343,Brown-Horn,Jessica Butler,brown-horn4@example.com,850-522-8252x38742,"85381 Dawn Avenue, Port Andreachester, VI 93905",Ingredients & Additives,OPEN_IN_PROGRESS,2023-01-23,2025-09-03T18:13:31.354621,1.2,2026-07-31,Already summer interesting now pattern possible newspaper bad a operation right professor music decide stop leave would current.
V1344,Frazier-Matthews,Dr. Vicki Lewis,frazier-matthews34@example.com,+1-412-416-8218x48681,"2133 Walter Landing, North Whitneyhaven, ID 42196",IT Services,OPEN_IN_PROGRESS,2025-02-07,2025-09-06T18:13:31.354890,2.5,2026-11-15,Finally method explain police establish before know positive popular plant president.
V1345,"Murray, Romero and Reed",Lynn Thomas,murray.romero.and.reed43@example.com,302-747-3790x47002,"32730 Scott Pass Apt. 688, North Russell, OR 66104",Logistics & Distribution,COMPLETED_ONBOARDED,2024-06-26,2025-01-16T18:13:31.355192,1.5,2026-01-03,Step face energy itself school two local identify into food third day ten event first.
V1346,Moreno-Scott,Randy Avery,moreno-scott31@example.com,(727)901-1612x534,"723 Rocha Crescent, Port Christopherchester, UT 46024",Manufacturing Equipment,YET_TO_RESPOND,2023-10-07,2025-02-22T18:13:31.355483,1.8,2027-02-02,Show now six line name institution indicate second page live learn relationship clear.
V1347,"Morales, Rogers and Roberts",Randall Hamilton,morales.rogers.and.roberts44@example.com,230.891.8035,"42598 Michelle Junctions, Sarahtown, FM 93741",Manufacturing Equipment,YET_TO_RESPOND,2024-05-02,2025-01-21T18:13:31.355765,2.9,2026-01-14,Stuff indeed million finally doctor trouble policy huge return step camera.
V1348,Jackson Inc,Monica Lewis DDS,jackson.inc33@example.com,001-307-370-8802x301,"7059 Alfred Shoals Apt. 704, East Theresa, VA 30237",Marketing & Advertising,COMPLETED_ONBOARDED,2024-03-29,2025-10-06T18:13:31.355992,2.1,2025-12-26,In military later for born note unit doctor hold owner baby lot hospital author treat pattern low wide American.
V1349,Russell-Clarke,Chelsea Flores,russell-clarke21@example.com,669-492-5356x7490,"958 Li Rue Apt. 915, Salazarfort, UT 00898",Raw Materials (Produce),OPEN_IN_PROGRESS,2025-06-14,2025-06-08T18:13:31.356275,3.2,2025-12-31,Probably nearly room probably field product future public fight charge fear thought rest report.
V1350,Williamson Ltd,Melanie Day,williamson.ltd40@example.com,745-611-5464x123,"Unit 0919 Box 5134, DPO AA 05056",Contract Manufacturing,YET_TO_RESPOND,2025-09-11,2025-05-15T18:13:31.356435,2.5,2026-04-04,Herself finish economic hospital hair huge government itself whether bank for return scene strong somebody coach.
V1351,Clay-Frederick,Angel Phillips,clay-frederick17@example.com,578-997-9036x8484,"7231 Jacob Shore, Matthewshire, NJ 26934",Manufacturing Equipment,YET_TO_RESPOND,2022-11-28,2025-08-01T18:13:31.356701,3.6,2026-08-15,Cold answer box early song choose reduce oil trouble different Mr make team director family specific.
V1352,Valdez-Rodriguez,Carl Donovan,valdez-rodriguez49@example.com,630-947-2508x1866,"65615 Bray Throughway Suite 339, South Timothy, DE 02110",Logistics & Distribution,YET_TO_RESPOND,2024-03-13,2025-06-04T18:13:31.356980,3.9,2027-01-06,Information watch one short worry high yeah build reduce rather choose consumer agreement others side.
V1353,Williams Group,Diana Zuniga,williams.group41@example.com,252-274-9322,"96243 Weber Heights Apt. 984, Silvabury, ID 21132",IT Services,YET_TO_RESPOND,2024-09-01,2024-12-27T18:13:31.357242,3.2,2025-11-10,Treatment apply camera floor toward many require statement quality remain say seem current continue great not with prevent him.
V1354,"Rosales, Craig and Willis",Kim Watson,rosales.craig.and.willis16@example.com,868.255.5709,"411 Barnes Plaza, Jordantown, VA 40579",Ingredients & Additives,OPEN_IN_PROGRESS,2024-12-05,2025-07-15T18:13:31.357548,4.3,2025-12-31,My clearly guy instead store economic deal top yet light provide military special door.
V1355,Lewis-Tran,Jamie Robertson,lewis-tran2@example.com,001-695-212-2247x9106,"545 Stephanie Club, Lake Kenneth, SC 40691",Manufacturing Equipment,COMPLETED_ONBOARDED,2025-03-16,2025-01-20T18:13:31.357798,4.9,2026-08-12,Sign imagine economic full we possible keep example hour heart sort create hope ground would not message raise.
V1356,"Williams, Murray and Gardner",Roberto Snyder,williams.murray.and.gardner24@example.com,9563568319,"2889 Jennifer Drive Apt. 998, East Nicole, PR 73261",Packaging Solutions,COMPLETED_ONBOARDED,2025-03-08,2025-03-17T18:13:31.358086,1.2,2025-12-05,Manage away rise management during wish loss system too book bar stage fine house thing sister during tend against thank growth.
V1357,Price-Martin,Tracy Hall,price-martin4@example.com,(274)323-0396x58876,"37146 George Pike, Jenniferside, NH 99759",Manufacturing Equipment,YET_TO_RESPOND,2024-12-21,2025-02-25T18:13:31.358338,1.2,2026-09-12,Explain prevent couple require order as democratic leader office remain perhaps.
V1358,"Wilkinson, Villa and Evans",Michael Woods,wilkinson.villa.and.evans30@example.com,(291)261-0346,"565 Ashley Spur Apt. 715, Lake Madison, AS 98981",IT Services,COMPLETED_ONBOARDED,2025-08-02,2025-08-13T18:13:31.358633,2.2,2026-07-15,Increase value experience already save factor listen by detail open situation attack author crime Mr cover pressure force especially significant wall.
V1359,"Hughes, Miller and Williams",Jennifer Greer,hughes.miller.and.williams39@example.com,001-595-851-2552x17768,"496 Erin Shoal, Lake Michaelborough, MP 75579",Marketing & Advertising,YET_TO_RESPOND,2025-01-30,2025-05-26T18:13:31.358930,1.3,2025-11-23,Data world note where actually budget check mind daughter carry individual develop good performance pressure four over difference the.
V1360,Hill-Crane,Mr. Karl Green Jr.,hill-crane26@example.com,338.691.6552x99765,"704 Jones Spur Apt. 470, South Elizabeth, WY 22314",Contract Manufacturing,OPEN_IN_PROGRESS,2025-03-24,2025-01-07T18:13:31.359211,2.2,2026-02-23,Will meeting page hotel color condition worry carry develop offer field relationship two light movement two.
V1361,Wilson-Henderson,Matthew Houston,wilson-henderson50@example.com,471.702.2325,"072 Donna Islands Apt. 482, Lake Amanda, MI 39370",Packaging Solutions,COMPLETED_ONBOARDED,2025-02-11,2025-10-05T18:13:31.359472,3.7,2026-03-18,South life culture adult when fly say commercial compare what technology our free its.
V1362,Foster-Madden,Latoya Ferrell,foster-madden9@example.com,874-712-5595x639,"60602 Susan Alley Apt. 982, Aaronborough, ND 72521",Raw Materials (Produce),COMPLETED_ONBOARDED,2023-02-24,2025-08-24T18:13:31.359741,1.1,2027-08-15,Production once majority movement month tonight half join study.
V1363,"Reed, Davila and Jensen",Richard Lara,reed.davila.and.jensen46@example.com,001-565-468-8175,"6263 Campbell Alley, Deannamouth, ME 30807",IT Services,OPEN_IN_PROGRESS,2023-04-29,2025-06-16T18:13:31.360044,3.7,2027-08-05,Music avoid mind usually military character protect key everyone beyond there senior property walk through expert young message system young us.
V1364,"Wagner, Gutierrez and Rivers",Eddie Lee,wagner.gutierrez.and.rivers44@example.com,220.498.4341x26240,"PSC 2281, Box 8895, APO AA 05954",Manufacturing Equipment,OPEN_IN_PROGRESS,2025-04-03,2024-12-22T18:13:31.360286,2.3,2026-01-09,Expect raise have hold professional around bit various inside nature method deep discover.
V1365,Anderson LLC,Daniel Herrera,anderson.llc22@example.com,+1-975-692-1684x6802,"163 Maria Mountains Apt. 891, Holmesberg, AL 98954",Manufacturing Equipment,YET_TO_RESPOND,2022-12-08,2024-10-31T18:13:31.360539,1.8,2027-02-24,Despite hope a summer pretty account summer sea country democratic about successful movie.
V1366,Liu-Brown,Christine Bailey,liu-brown19@example.com,+1-903-612-7939x5282,"PSC 5275, Box 4044, APO AE 27043",Contract Manufacturing,OPEN_IN_PROGRESS,2024-09-18,2025-04-14T18:13:31.360739,3.2,2026-01-26,Development college computer admit buy writer seven wall important general.
V1367,Baldwin PLC,Jack Thompson,baldwin.plc18@example.com,+1-692-650-2274x78957,"147 Smith Plains Apt. 806, Lake Jennifer, VI 45798",Ingredients & Additives,YET_TO_RESPOND,2024-08-19,2024-12-18T18:13:31.361023,3.4,2026-08-18,Space hear building why might her simple before animal training become opportunity commercial subject raise great.
V1368,Williams-Nguyen,David Park,williams-nguyen48@example.com,975.572.3080,"28666 Hawkins Place Apt. 651, Port Angelicamouth, CO 14125",Raw Materials (Produce),YET_TO_RESPOND,2024-09-11,2025-04-21T18:13:31.361304,4.7,2027-03-15,Religious a across computer too someone seek teacher cell green ground air ago what grow century.
V1369,Kelly Inc,Colton Galvan,kelly.inc31@example.com,(763)963-6611,"232 Zachary Road Suite 523, East Barbaraland, OH 90563",Manufacturing Equipment,YET_TO_RESPOND,2023-02-08,2025-09-26T18:13:31.361534,4.7,2026-04-08,Town hour magazine day what offer letter by reality.
V1370,Bonilla and Sons,Edward Davis,bonilla.and.sons15@example.com,001-645-907-7197x429,"PSC 5754, Box 7798, APO AA 10871",Marketing & Advertising,OPEN_IN_PROGRESS,2025-03-25,2024-12-16T18:13:31.361696,2.8,2026-10-03,Physical which question behind girl standard everything hospital choice effort threat contain her style method.
V1371,Davis LLC,Olivia Wilkerson,davis.llc27@example.com,475.920.7893,"34385 Sandra Haven Apt. 411, Johnstontown, OR 21797",Manufacturing Equipment,COMPLETED_ONBOARDED,2022-11-28,2025-07-23T18:13:31.361936,1.1,2026-01-02,Follow out Democrat cover over rise born next watch spring charge open.
V1372,Myers Ltd,Jacob Howe,myers.ltd26@example.com,361-390-5059x71726,"PSC 7778, Box 5114, APO AA 35900",Packaging Solutions,COMPLETED_ONBOARDED,2024-05-07,2025-08-27T18:13:31.362100,3.6,2027-02-14,Different Congress chance data cold laugh together real seat service safe half might where think tough surface benefit.
V1373,Jones-Meadows,Marilyn Montgomery,jones-meadows15@example.com,(656)220-5924,"022 Branch Camp, South Pamelaville, OR 62105",Raw Materials (Produce),OPEN_IN_PROGRESS,2023-08-19,2024-12-31T18:13:31.362367,3.9,2026-10-28,Fight store police last several travel difference develop whole this picture.
V1374,Ingram-Henry,Douglas Pacheco,ingram-henry21@example.com,607.747.5634x5616,"3586 Wolfe Coves, New Mark, CT 25717",Logistics & Distribution,YET_TO_RESPOND,2025-01-05,2025-06-23T18:13:31.362635,4.1,2027-05-29,State focus budget tonight street allow site for full if.
V1375,"Johnson, Elliott and Marshall",Doris Lewis,johnson.elliott.and.marshall14@example.com,001-636-967-7455x1412,"28247 Cardenas Ramp, Crystalside, FL 29796",Marketing & Advertising,COMPLETED_ONBOARDED,2025-06-04,2025-02-16T18:13:31.362940,2.8,2025-12-24,Interview minute TV ask together time why cell for soon little bank simply prevent after.
V1376,"Allen, Wright and Nelson",Vanessa Miles,allen.wright.and.nelson40@example.com,314-460-2856,"3768 Joshua Terrace Suite 678, Nicoleland, AK 89173",IT Services,OPEN_IN_PROGRESS,2024-05-25,2025-04-17T18:13:31.363239,4.5,2027-02-13,Class program think bed economic majority community room piece century.
V1377,Adams-Weber,Andre Wilkinson,adams-weber42@example.com,001-624-281-7373x64916,"244 George Expressway, Port Hollyfort, MI 85292",Marketing & Advertising,OPEN_IN_PROGRESS,2025-03-01,2025-04-09T18:13:31.363497,2.9,2026-01-01,I happen quite trip also upon new particular experience itself generation front think guess true note.
V1378,Mendoza-Jones,Rebecca Nelson,mendoza-jones12@example.com,756-986-6486,"55521 Ryan Stream Apt. 737, Olsenview, CO 76236",IT Services,COMPLETED_ONBOARDED,2025-10-16,2024-12-21T18:13:31.363781,4.9,2027-06-27,Child tree move draw truth magazine dog before power north use blood ahead film.
V1379,"Martinez, Jones and Gross",Kristen Scott,martinez.jones.and.gross20@example.com,001-598-998-9838x821,"24279 Morales Spur Apt. 401, Englishshire, MO 70261",Manufacturing Equipment,YET_TO_RESPOND,2025-01-17,2025-02-10T18:13:31.364103,1.1,2026-05-28,Effort network draw job exactly serve teach financial capital gun member course national perhaps professional show young fish entire cultural.
V1380,Stewart-Galloway,Bradley Williamson,stewart-galloway29@example.com,312.666.9980,"332 Heather Parkways Apt. 664, Andersonfort, MO 54690",Marketing & Advertising,COMPLETED_ONBOARDED,2022-11-23,2025-08-10T18:13:31.364373,3.0,2025-11-02,Dinner give ground fall same any wrong physical hair guess expect list always author yes whom follow full piece expect.
V1381,Patel PLC,Kristen Nichols,patel.plc15@example.com,960-438-4084x50438,"0235 Ashley Drive Suite 904, Lake Ian, AK 66723",Raw Materials (Produce),OPEN_IN_PROGRESS,2024-10-25,2025-02-18T18:13:31.364603,1.4,2026-12-31,Friend world notice paper artist air movement leader him nice decision score argue away economic.
V1382,Smith Ltd,Brian Vasquez,smith.ltd20@example.com,367.773.8542,"6057 Vasquez Courts, New Jasonfort, UT 95203",Ingredients & Additives,YET_TO_RESPOND,2023-09-10,2025-10-01T18:13:31.364837,4.0,2027-03-29,Necessary where food change recognize against medical strong purpose international population piece bed look like because quickly go respond whole.
V1383,Medina-Turner,Nicole Palmer,medina-turner45@example.com,451-496-3091,"763 Robinson Street, North Michaelburgh, NY 46817",Manufacturing Equipment,COMPLETED_ONBOARDED,2025-03-26,2025-06-28T18:13:31.365104,4.7,2026-05-12,Include coach I interview service poor at measure goal which indicate develop easy.
V1384,Jensen Inc,Brandi Palmer,jensen.inc4@example.com,(880)356-8966x9724,"711 Scott Center, Toniport, LA 29155",Raw Materials (Produce),COMPLETED_ONBOARDED,2023-08-19,2025-06-21T18:13:31.365338,3.7,2026-08-01,Herself another experience while theory stuff material purpose free outside south company speak somebody main for break determine help.
V1385,Bryant-Beck,Tammy Ellis,bryant-beck28@example.com,956.919.5023,"482 Gonzalez Shoals Apt. 602, Jadeberg, RI 58019",Contract Manufacturing,COMPLETED_ONBOARDED,2023-08-24,2024-10-27T18:13:31.365609,1.0,2027-03-05,Others program conference provide feeling similar window mention truth guess music everything hundred option around buy.
V1386,"Edwards, Jones and Bell",Ryan Robertson,edwards.jones.and.bell49@example.com,5702380917,"8177 Herman Trail, Jonesside, WV 27248",Ingredients & Additives,COMPLETED_ONBOARDED,2023-04-17,2025-02-19T18:13:31.365921,1.7,2026-03-13,Central main light night during light design song size movement century difficult price site figure century six writer.
V1387,"Barrett, Perry and Williams",Steven Davila,barrett.perry.and.williams20@example.com,818-477-3103x9975,"217 Mueller Garden Suite 716, Cliffordhaven, NH 62573",Raw Materials (Produce),YET_TO_RESPOND,2024-10-17,2024-11-15T18:13:31.366252,3.1,2026-01-03,She industry be believe push lead address program race defense seek away eight whom.
V1388,Norton PLC,Herbert Marshall,norton.plc1@example.com,855.423.7095x83778,"94125 Justin Burgs, Lake Melissatown, NY 55613",Raw Materials (Produce),COMPLETED_ONBOARDED,2023-12-24,2025-08-31T18:13:31.366495,3.8,2027-09-29,At physical customer now third see skin thus sometimes itself with answer not act its question have base.
V1389,Martinez Ltd,Courtney Davis,martinez.ltd5@example.com,4475939853,"0515 Fritz Branch Suite 064, South Johnburgh, RI 13099",Raw Materials (Produce),OPEN_IN_PROGRESS,2024-01-12,2025-06-28T18:13:31.366739,4.9,2025-12-20,Worker now administration concern today cause important kind by level reason admit garden lead name any poor heavy.
V1390,"Carr, Banks and Wiley",Linda James,carr.banks.and.wiley39@example.com,001-350-205-8663x0206,"0883 Julia Fords Suite 367, Wilsonville, MN 89313",Manufacturing Equipment,COMPLETED_ONBOARDED,2023-07-14,2025-04-28T18:13:31.367050,1.8,2026-08-12,Democrat big none hard Republican at rise rest word let sound worker bit record.
V1391,Garcia-Medina,Jorge Valenzuela,garcia-medina23@example.com,4833545054,"1474 Crawford Centers, Silvashire, MH 49836",Contract Manufacturing,OPEN_IN_PROGRESS,2024-06-10,2024-11-12T18:13:31.367328,1.1,2027-07-22,Certainly author later simply her within individual trouble history.
V1392,Combs PLC,Brenda Smith,combs.plc44@example.com,210.631.0287,"1891 Price Mills, Welchshire, NJ 85290",Ingredients & Additives,YET_TO_RESPOND,2023-05-16,2025-04-01T18:13:31.367570,4.8,2025-11-01,Those skill middle side sign watch point better our see owner answer common seek eat by response impact door manager.
V1393,Allen and Sons,Albert Martin,allen.and.sons27@example.com,434-382-2893,"484 Amber Flat Suite 077, Port Christopherville, ID 19936",Logistics & Distribution,YET_TO_RESPOND,2025-03-16,2025-04-19T18:13:31.367798,3.1,2026-01-02,Kind listen class as but or cause mention because under then.
V1394,Jackson Group,Amy Stewart,jackson.group39@example.com,240.291.0054x23048,"8338 Carrillo Fords Suite 301, Patriciamouth, NV 34886",Manufacturing Equipment,YET_TO_RESPOND,2023-12-20,2025-06-02T18:13:31.368040,2.0,2026-11-07,Clearly sport represent after suggest despite course yeah late meeting.
V1395,Vega-Perez,Jason Gaines,vega-perez8@example.com,276-627-5584,"034 Lopez Groves, New Leeville, PA 54092",Marketing & Advertising,COMPLETED_ONBOARDED,2023-11-28,2024-12-21T18:13:31.368305,4.1,2026-06-09,Yes course Mrs southern recently specific happen college happen speak.
V1396,Perez Ltd,Sandra Coleman,perez.ltd30@example.com,001-233-232-2670x8027,"USS Johnson, FPO AP 32266",Packaging Solutions,COMPLETED_ONBOARDED,2023-12-18,2025-05-31T18:13:31.368499,2.3,2027-08-11,East successful consider interesting you cost arrive up try almost subject these member.
V1397,Weaver Group,Jennifer Wells,weaver.group31@example.com,757-593-1226x867,"291 Kari Avenue, Leestad, HI 17368",Logistics & Distribution,YET_TO_RESPOND,2024-09-28,2025-03-26T18:13:31.368733,2.9,2026-06-12,Skill current someone woman sea little win final present floor professor often life focus evidence happen campaign drug future.
V1398,Whitney-Graves,Melinda Keith,whitney-graves20@example.com,657-674-2387x857,"62087 Saunders Junctions, Matthewtown, VT 84187",Marketing & Advertising,YET_TO_RESPOND,2025-05-04,2025-01-26T18:13:31.369002,3.6,2026-03-16,Both help player hard civil relate better training drug military full agent language similar century outside.
