vendorId,companyName,primaryContactName,primaryContactEmail,phoneNumber,address,category,engagementStatus,registrationDate,lastInteractionDate,performanceRating,contractEndDate,notes
V1241,"Walters, Rivera and Hill",Peter Padilla,walters.rivera.and.hill13@example.com,+1-587-546-7019,"7364 Reese Route, Derekstad, IA 43096",Manufacturing Equipment,COMPLETED_ONBOARDED,2023-06-14,2024-12-02T18:13:31.327777,1.4,2026-03-13,Price true evening garden measure beyond administration hot gun.
V1242,Charles Ltd,Shawn Rodriguez,charles.ltd12@example.com,316.594.7376,"97009 Jeffrey Fall, Elliottberg, CA 23468",IT Services,YET_TO_RESPOND,2023-07-28,2025-05-19T18:13:31.328009,1.5,2025-11-17,Like rise effect make rate condition away daughter hard democratic make ever.
V1243,"Campbell, Osborne and Coleman",Devin Wright,campbell.osborne.and.coleman12@example.com,(583)696-1753x8225,"1803 Leah Vista Suite 330, Lake Michelleborough, VA 75593",Contract Manufacturing,YET_TO_RESPOND,2024-03-12,2025-03-20T18:13:31.328317,1.5,2026-01-07,Care million east magazine phone become edge size service until behind citizen common sure single popular edge between though cut order.
V1244,Oliver Group,Clinton Erickson,oliver.group18@example.com,(791)467-1221x172,"Unit 1089 Box 6221, DPO AA 57755",IT Services,COMPLETED_ONBOARDED,2025-10-07,2024-10-24T18:13:31.328480,4.2,2025-12-29,Time including fight black outside professor reach moment message tax.
V1245,Cruz-Vega,Miss Kristina Christensen,cruz-vega27@example.com,5926477322,"USNV Wright, FPO AE 88687",IT Services,COMPLETED_ONBOARDED,2023-04-07,2025-04-21T18:13:31.328708,2.7,2026-05-29,Tax agent others nice practice per trade science western.
V1246,King and Sons,Priscilla Gamble,king.and.sons43@example.com,640-620-4249x217,"41811 Cole Coves, Nashstad, GA 43661",Packaging Solutions,OPEN_IN_PROGRESS,2023-10-03,2025-05-02T18:13:31.328960,4.9,2026-10-24,Wide next city whom chair political movement worker field.
V1247,"Harris, Thompson and Dixon",Mary Mahoney,harris.thompson.and.dixon1@example.com,001-331-667-7124x3403,"8797 Natasha Greens, Lake Michelle, TX 72841",Marketing & Advertising,OPEN_IN_PROGRESS,2024-11-07,2025-04-20T18:13:31.329262,1.9,2026-07-20,Responsibility language likely mean social center throughout manage claim look event.
V1248,"Rodriguez, Roberts and Dennis",Thomas Carr MD,rodriguez.roberts.and.dennis12@example.com,267.644.6508x9765,"1949 Jackson Bypass, Port Tonyaport, CA 63101",Raw Materials (Produce),OPEN_IN_PROGRESS,2024-10-17,2025-01-21T18:13:31.329572,2.6,2026-06-28,Fire soldier back player strong face whose federal name some.
V1249,"Brown, Sharp and Higgins",Scott Bass,brown.sharp.and.higgins36@example.com,499.372.7035,"42326 Lori Glen Apt. 279, Alexismouth, NV 17131",Ingredients & Additives,COMPLETED_ONBOARDED,2023-07-27,2024-10-28T18:13:31.329867,3.1,2027-03-18,Hard personal defense serve these watch war party behavior around her respond simply international agree relate cut around bar support.
V1250,"Mueller, Allen and Romero",Levi Salazar,mueller.allen.and.romero1@example.com,821-612-0944x9468,"6234 Victoria Isle, Whiteshire, MA 00902",Raw Materials (Produce),YET_TO_RESPOND,2023-08-22,2024-11-16T18:13:31.330169,3.4,2025-11-30,Film carry whatever analysis short production throw agree force wind film.
V1251,"Ballard, Graham and Wiley",Bonnie Davis,ballard.graham.and.wiley37@example.com,981-603-7072,"31859 Rachel Turnpike, Padillashire, MS 64378",Ingredients & Additives,COMPLETED_ONBOARDED,2023-05-27,2025-04-27T18:13:31.330471,4.7,2025-12-13,Black color major law chair letter attack special kid everybody toward heart attention choose after they bag something dark.
V1252,"Ponce, Hernandez and Davis",Donald Rush,ponce.hernandez.and.davis7@example.com,976.409.8685,"0427 Vargas Extension Apt. 122, Thomasfort, RI 44213",Packaging Solutions,YET_TO_RESPOND,2025-08-25,2025-08-15T18:13:31.330787,1.1,2026-06-15,Where child ball value discussion TV yourself anything party phone stop camera medical use.
V1253,Dyer LLC,Tammy Mcmahon,dyer.llc8@example.com,5188380632,"28811 Angela Lodge Suite 984, Sharonberg, SC 44879",Logistics & Distribution,YET_TO_RESPOND,2024-03-06,2025-01-09T18:13:31.331012,1.4,2026-06-19,Country nothing before police country all station third shoulder thank very over agency hope serve available close car strategy nation place.
V1254,"Robinson, Petersen and Robertson",Derrick Patton,robinson.petersen.and.robertson17@example.com,480.846.3246x57366,"52881 Thomas Mall Suite 430, East Johnmouth, NJ 15338",Ingredients & Additives,OPEN_IN_PROGRESS,2024-01-09,2024-11-11T18:13:31.331324,2.6,2026-10-23,Occur attorney occur politics feeling organization development measure audience join role current future ten four social need.
V1255,Riley-Oconnor,Richard Proctor,riley-oconnor50@example.com,001-910-344-2624x328,"567 Anita Ridges, Castillochester, IA 07434",Packaging Solutions,YET_TO_RESPOND,2024-08-08,2025-10-13T18:13:31.331590,2.5,2026-12-25,Experience piece thank stuff gas all while recent daughter necessary must education strong back fill.
V1256,Rice Group,Dana Ballard,rice.group31@example.com,+1-543-239-3622x41859,"4188 Nguyen Gardens Suite 136, Masonchester, ID 69594",Logistics & Distribution,OPEN_IN_PROGRESS,2023-03-31,2025-05-08T18:13:31.331842,4.3,2026-10-20,Own to stage accept again single other executive build either produce operation far town suggest design pay company.
V1257,"Kim, Mcfarland and Wagner",Patricia Johnson,kim.mcfarland.and.wagner37@example.com,+1-440-336-5973x2718,"083 Ryan Mission, Boothport, AZ 46782",Marketing & Advertising,OPEN_IN_PROGRESS,2025-07-09,2025-06-02T18:13:31.332149,3.2,2026-12-13,Charge smile year lead star school close education land to according city.
V1258,Rocha LLC,Juan Juarez,rocha.llc2@example.com,330-799-9956,"93188 Nichole Valley Apt. 952, Abigailfurt, AL 63841",Logistics & Distribution,YET_TO_RESPOND,2022-10-24,2025-05-30T18:13:31.332376,1.6,2026-06-17,Across oil end morning style nice condition light professor catch quite the analysis adult ask claim exist.
V1259,Stone-Johnson,Danielle Solis,stone-johnson4@example.com,341-472-5760x97711,"405 Larry Manor, Boydview, NE 64641",Contract Manufacturing,COMPLETED_ONBOARDED,2023-09-29,2025-02-08T18:13:31.332645,4.1,2025-12-14,Ready magazine card unit type individual off along bar amount.
V1260,"Thomas, Bennett and Wang",Jose Armstrong,thomas.bennett.and.wang29@example.com,659-894-2949x02650,"1570 Larry Shoals, North Brianberg, TN 32443",Manufacturing Equipment,COMPLETED_ONBOARDED,2023-09-28,2025-08-17T18:13:31.332940,4.6,2027-04-12,Listen argue raise part action election like somebody perhaps compare buy enter.
V1261,"Baxter, Martinez and Mccann",Anna Ramirez,baxter.martinez.and.mccann1@example.com,001-861-561-9410x882,"5971 Carpenter Roads, East Monique, KS 96588",Manufacturing Equipment,YET_TO_RESPOND,2023-09-30,2024-11-18T18:13:31.333268,5.0,2026-04-04,Thing challenge truth bring might staff stand eat great after account degree pretty value far end security.
V1262,Rivera Ltd,Eric Johnson,rivera.ltd34@example.com,403.981.0939,"1575 Kenneth River Suite 036, Port Jennifermouth, AR 60570",Raw Materials (Produce),COMPLETED_ONBOARDED,2024-11-21,2024-10-31T18:13:31.333496,1.8,2027-04-19,Something listen level hour year serve social cost inside likely up gas art.
V1263,"Gomez, Jones and Patel",Timothy Jones,gomez.jones.and.patel24@example.com,443-674-4734x2286,"32778 Jessica Parkway Suite 120, North Sabrinaberg, NV 76865",Packaging Solutions,OPEN_IN_PROGRESS,2024-02-08,2025-01-12T18:13:31.333797,2.3,2026-07-04,Firm at place cut ball throw model water just partner end three respond staff read man under reflect it.
V1264,Gordon-Navarro,Joshua Wright,gordon-navarro8@example.com,+1-414-620-3025x455,"3093 Long Walks Apt. 887, West Jeannehaven, AK 02129",Manufacturing Equipment,COMPLETED_ONBOARDED,2024-09-17,2025-02-13T18:13:31.334080,1.6,2027-10-15,Political ground similar every chair local forward book operation above street debate.
V1265,"Johnson, Thomas and Mccarthy",Margaret Roberts,johnson.thomas.and.mccarthy38@example.com,+1-798-795-8618x1834,"75886 Bobby Summit Apt. 288, Reynoldsshire, NJ 90566",Packaging Solutions,COMPLETED_ONBOARDED,2025-03-13,2025-04-20T18:13:31.334390,4.3,2026-05-27,Throw choice which push system fill land student raise hand single election concern others wrong.
V1266,Bauer-Camacho,Kristie Miller,bauer-camacho48@example.com,(337)572-6368,"PSC 0536, Box 6371, APO AA 67433",Contract Manufacturing,COMPLETED_ONBOARDED,2024-06-30,2024-12-02T18:13:31.334584,3.0,2026-03-10,Play bed scientist international worker do plan here some indeed economy lose each line language college through major raise real.
V1267,Daniel-Hernandez,Glenn Frederick,daniel-hernandez28@example.com,+1-633-646-6466x4457,"066 Margaret Squares, East Rachelhaven, OH 86983",Ingredients & Additives,COMPLETED_ONBOARDED,2023-09-05,2025-06-20T18:13:31.334842,2.5,2027-08-13,Design war soon mission member policy themselves huge second ok wide student federal.
V1268,Parker-Williams,Frank Brown,parker-williams12@example.com,+1-712-836-9837x31474,"6676 Anderson Stream Apt. 971, New Dana, MS 85927",Logistics & Distribution,COMPLETED_ONBOARDED,2024-12-22,2025-01-26T18:13:31.335117,3.3,2027-01-15,Same model they PM choice across blood pressure player professional table federal bring.
V1269,Dudley Group,Kara Washington,dudley.group40@example.com,5819794318,"Unit 6902 Box 8075, DPO AE 00924",Manufacturing Equipment,OPEN_IN_PROGRESS,2023-01-13,2025-01-13T18:13:31.335277,1.3,2026-05-31,Standard will tree throughout sound project Democrat wide care technology born kind government carry together set than computer.
V1270,Chaney-Phillips,Fernando Alvarez,chaney-phillips49@example.com,(382)993-2302x4270,"517 Walker Ways, Coleport, AZ 61182",Logistics & Distribution,COMPLETED_ONBOARDED,2023-11-24,2024-11-06T18:13:31.335554,2.2,2027-07-10,Tv movement reason position attack whatever free expect difference central range no unit everyone manager manager almost door hotel seat.
V1271,Cruz Ltd,Michael Lopez,cruz.ltd19@example.com,+1-760-729-6140x58239,"16816 Cindy Creek, East James, VT 01565",Logistics & Distribution,COMPLETED_ONBOARDED,2025-03-30,2024-11-19T18:13:31.335781,3.3,2026-06-06,East build month word everyone line whose Republican other according fund parent third board and brother necessary oil close arm.
V1272,Collins-Ferrell,Tanner Cox,collins-ferrell16@example.com,+1-845-582-8485x02068,"5748 Ramirez Pine Apt. 735, New Albertland, PR 76198",Packaging Solutions,COMPLETED_ONBOARDED,2024-05-17,2024-12-08T18:13:31.336057,3.5,2027-07-29,Maybe structure rate major final up break alone police around friend song.
V1273,"Brown, Odom and Johnson",Nicholas Harding,brown.odom.and.johnson42@example.com,973-509-7287,"797 Miller Stravenue, North Ericstad, LA 82783",Marketing & Advertising,OPEN_IN_PROGRESS,2024-02-06,2025-07-27T18:13:31.336367,2.6,2027-09-23,Star relationship house table evidence section really just body.
V1274,"Fox, Rogers and Robinson",Dustin Collins,fox.rogers.and.robinson3@example.com,001-327-320-7817,"PSC 6273, Box 8461, APO AP 93736",IT Services,YET_TO_RESPOND,2025-04-01,2024-12-07T18:13:31.336599,2.4,2025-12-05,His media pay black fine recognize agency explain do region heavy control system special actually opportunity.
V1275,Lane-Pollard,Heidi Kane,lane-pollard33@example.com,001-993-796-8016x67777,"2322 Jerry Shores, Jonesville, KS 91418",Logistics & Distribution,YET_TO_RESPOND,2022-12-29,2025-04-06T18:13:31.336871,5.0,2026-05-14,Kitchen option seven prepare pay sell marriage lay require child raise west drop must truth around sit fly far use.
V1276,Wallace and Sons,Erin Martin,wallace.and.sons17@example.com,6026530801,"8147 Ramirez Coves, Armstrongville, IN 35196",Marketing & Advertising,YET_TO_RESPOND,2024-02-29,2025-01-26T18:13:31.337114,1.9,2027-01-21,Top performance evening red accept bring treat keep fact.
V1277,"Olson, Hernandez and Gonzalez",Dana Baker,olson.hernandez.and.gonzalez4@example.com,(916)597-9551,"PSC 4863, Box 3762, APO AP 99082",Contract Manufacturing,COMPLETED_ONBOARDED,2025-07-18,2025-01-19T18:13:31.337346,4.5,2026-09-18,Environmental quite base list it rest model per position.
V1278,Marsh and Sons,Adrian Martin,marsh.and.sons20@example.com,430-836-6690,"529 Harry Groves, Port Paulton, AZ 58858",Ingredients & Additives,COMPLETED_ONBOARDED,2025-01-08,2025-01-15T18:13:31.337564,2.2,2026-01-28,After resource college before top wish meet day push cultural score move gun its month.
V1279,Meyer-Stewart,Nicole Frank,meyer-stewart4@example.com,+1-848-514-8405x58887,"46583 Jasmine Fall Suite 856, Port Jasonchester, OK 43221",Manufacturing Equipment,OPEN_IN_PROGRESS,2025-01-03,2025-07-19T18:13:31.337833,3.1,2026-04-11,Style quickly finish option until experience four movie usually concern more point still dream small evening girl court natural.
V1280,Smith LLC,Leah Kelley,smith.llc12@example.com,380.991.6156x586,"017 Herrera Avenue, North Nicholas, KS 11951",Logistics & Distribution,YET_TO_RESPOND,2022-12-08,2025-06-14T18:13:31.338072,3.5,2027-10-01,Themselves trouble bed direction lead environmental strong important realize method blue couple save sign detail strategy Republican will same process.
V1281,"Brown, Taylor and Oneill",Shelly Johnson,brown.taylor.and.oneill22@example.com,(954)840-5609,"975 Christina Motorway Apt. 012, New Williambury, KS 15505",Ingredients & Additives,YET_TO_RESPOND,2024-03-18,2025-02-02T18:13:31.338371,1.6,2027-03-17,Factor court bed hospital give money game simple rich imagine only half customer.
V1282,"Fisher, Garza and Rose",Ryan Garcia,fisher.garza.and.rose9@example.com,001-388-948-3024,"225 Fowler Path, Michaelton, AK 22294",Logistics & Distribution,YET_TO_RESPOND,2024-11-08,2025-04-06T18:13:31.338669,4.1,2027-02-26,Personal and local choice action respond lawyer until study late there across seem.
V1283,Price and Sons,Carla Carroll,price.and.sons50@example.com,715.582.5111x718,"96334 Grace Stream, East Valeriemouth, GU 01345",Packaging Solutions,OPEN_IN_PROGRESS,2024-06-19,2025-06-26T18:13:31.338894,3.3,2025-11-13,Leader reflect make hard event matter behavior impact per discussion.
V1284,Green PLC,Emily Vaughan,green.plc38@example.com,001-836-249-6944x566,"310 Margaret Center, Brooksside, OR 16240",Ingredients & Additives,YET_TO_RESPOND,2023-01-15,2025-02-21T18:13:31.339126,4.2,2026-02-23,Field institution some customer that ask expert voice scientist ball expert coach provide skin to hit hit source game.
V1285,"Johns, Smith and Atkins",David Castillo,johns.smith.and.atkins18@example.com,(390)866-8990x639,"USNS Clark, FPO AP 77084",Contract Manufacturing,COMPLETED_ONBOARDED,2023-08-17,2025-05-14T18:13:31.339389,2.9,2027-07-04,Time there become term single serve true and arm level stock.
V1286,Tran Inc,David Fields,tran.inc47@example.com,001-697-641-2038x897,"46806 Terri Stream, Richmouth, PR 60014",IT Services,YET_TO_RESPOND,2023-10-09,2025-02-26T18:13:31.339623,4.8,2026-01-12,Nothing foreign instead window natural goal owner and decide behind word explain instead hotel rather every home guy.
V1287,Edwards PLC,Emily Lopez,edwards.plc39@example.com,001-907-273-1911,"PSC 7932, Box 8463, APO AE 52406",Contract Manufacturing,OPEN_IN_PROGRESS,2023-05-04,2025-02-03T18:13:31.339789,1.7,2027-03-23,Religious dog fire move out weight public instead professor son wind develop administration threat stock ten whose area activity value way.
V1288,"Lopez, Ho and Taylor",Angela Hampton,lopez.ho.and.taylor40@example.com,2364077840,"637 Deborah Manor, West Dianeberg, CO 70364",Contract Manufacturing,COMPLETED_ONBOARDED,2023-05-10,2025-09-14T18:13:31.340088,3.2,2025-11-20,Science individual election discuss success in ok often such who.
V1289,"Martinez, David and Barker",Timothy George,martinez.david.and.barker40@example.com,757-717-8504,"11331 Vargas Stravenue Suite 464, Cliffordfort, MP 28144",Contract Manufacturing,OPEN_IN_PROGRESS,2024-04-24,2025-10-06T18:13:31.340414,1.1,2027-06-03,Number right affect fly decision accept work pretty side yet second entire home military young glass song anything before speech power.
V1290,Williams-Mckay,Dennis Wright,williams-mckay50@example.com,+1-872-587-9259,"64755 Vasquez Extension, Ramosfurt, AS 69885",Contract Manufacturing,COMPLETED_ONBOARDED,2023-01-12,2024-12-17T18:13:31.340706,2.4,2026-01-10,Event another common hard three Mrs many federal weight and left behind only newspaper admit parent affect pick.
V1291,"Thompson, Flores and Williams",Tracy Taylor,thompson.flores.and.williams10@example.com,+1-936-675-3769x61792,"6279 Sabrina Extensions Suite 726, Myersfort, TX 04519",Contract Manufacturing,YET_TO_RESPOND,2023-09-07,2025-07-13T18:13:31.341016,3.2,2027-06-12,East soldier class energy range use especially pay however personal manager different rise enough because whom read miss civil.
V1292,Miller Inc,Colin Hudson,miller.inc34@example.com,3882271353,"39678 Harrington Summit, Lake Jacobport, CA 52836",Raw Materials (Produce),OPEN_IN_PROGRESS,2023-08-20,2025-04-26T18:13:31.341248,3.0,2026-11-12,Point become politics should someone determine government as mouth catch hair worry night space away soon doctor investment wife.
V1293,Lee PLC,Angela Gould,lee.plc43@example.com,725-604-8423,"75052 Jennifer Orchard Apt. 705, Colinton, DC 03729",Manufacturing Equipment,YET_TO_RESPOND,2024-03-13,2025-07-02T18:13:31.341475,1.8,2026-12-10,Sign fund age try PM at public never back adult morning.
V1294,Huffman-Hernandez,Dana Medina,huffman-hernandez27@example.com,(341)596-9808,"989 Courtney Row, East Allison, PA 79748",IT Services,YET_TO_RESPOND,2023-11-21,2025-03-04T18:13:31.341728,2.9,2026-06-03,Improve enough ever pattern full there clear society wife according seem treatment change ten.
V1295,Moran-Williams,Rebecca Williams,moran-williams32@example.com,496.457.7406x150,"831 Anderson Parks Apt. 458, New Stevenhaven, AK 54942",Packaging Solutions,YET_TO_RESPOND,2025-03-23,2025-07-31T18:13:31.342003,1.1,2026-08-18,Sort thought unit authority level easy policy quality attention and imagine provide father.
V1296,"Carpenter, Smith and Fry",Carolyn Marshall,carpenter.smith.and.fry30@example.com,+1-586-947-1451,"53065 Sarah Camp, Adrienneberg, FM 61367",Logistics & Distribution,OPEN_IN_PROGRESS,2023-05-14,2025-06-25T18:13:31.342293,3.2,2026-12-30,Boy visit behavior view task affect ball either state suffer reveal author major around also particular.
V1297,Davis-Padilla,Jenna Campbell,davis-padilla41@example.com,361-616-6609x50898,"816 Brown Tunnel, Hernandezside, GA 04697",Manufacturing Equipment,YET_TO_RESPOND,2023-07-16,2024-12-17T18:13:31.342596,1.2,2027-09-05,Soon security discover degree degree establish season case continue later garden meeting support evidence TV use issue budget.
V1298,Hughes and Sons,Kelly Coleman,hughes.and.sons36@example.com,+1-989-915-2883x64843,"27417 Day Radial, New Lori, MA 44822",Manufacturing Equipment,YET_TO_RESPOND,2023-02-03,2025-08-16T18:13:31.342831,2.3,2027-02-20,Marriage behind explain none let big cover close again campaign.
V1299,Benton-Rodriguez,David Schultz,benton-rodriguez40@example.com,001-656-489-4139x790,"435 Fowler Crossroad, Lake Austin, WV 28676",Packaging Solutions,OPEN_IN_PROGRESS,2023-05-11,2025-09-23T18:13:31.343096,3.0,2026-03-27,Must drop without space few or action laugh social tell what education.
V1300,May-Vargas,Brian Clark,may-vargas13@example.com,9934571693,"46693 Blackwell Road Apt. 601, Deborahborough, PW 52712",Marketing & Advertising,COMPLETED_ONBOARDED,2023-08-24,2025-06-28T18:13:31.343367,2.1,2026-11-17,Pattern against detail white establish attorney television concern brother customer list.
V1301,"Gonzales, Hanna and Williams",Mr. Scott Lawrence,gonzales.hanna.and.williams46@example.com,440.343.5527x10435,"60518 Holmes Fields, New Kari, TN 06445",Ingredients & Additives,OPEN_IN_PROGRESS,2024-02-28,2025-07-14T18:13:31.343676,2.8,2026-08-09,Nothing like head become member mind sometimes son deal most teacher seem fire kind before yeah avoid environment.
V1302,"Perry, Roy and Caldwell",Tina Le,perry.roy.and.caldwell28@example.com,(281)663-9227x5994,"29969 Sean Mills Suite 192, New Paul, CT 77355",Ingredients & Additives,YET_TO_RESPOND,2023-04-03,2025-01-12T18:13:31.343976,1.1,2025-11-11,Color until free analysis pass him price remember set decade evidence.
V1303,"Smith, Ortiz and Colon",Corey Woodward,smith.ortiz.and.colon5@example.com,+1-837-484-2830x0568,"014 Mary Stravenue Apt. 823, Sandersview, NM 87093",Manufacturing Equipment,YET_TO_RESPOND,2022-11-07,2025-09-27T18:13:31.344283,2.4,2026-03-05,Task trial wrong trouble animal there million others front life woman data audience.
V1304,Walker-Casey,Madison Nicholson,walker-casey4@example.com,992.852.4290x4492,"183 David Spur, Zacharyberg, RI 61066",Marketing & Advertising,OPEN_IN_PROGRESS,2023-06-08,2025-08-14T18:13:31.344537,4.5,2027-09-19,Call work yourself little build new level carry run.
V1305,Schultz LLC,Dr. Tony Gould,schultz.llc49@example.com,206.653.4300x53495,"4337 Mccarthy Divide Apt. 962, New Jamesburgh, MO 43343",Marketing & Advertising,YET_TO_RESPOND,2025-09-05,2025-05-17T18:13:31.344781,4.7,2026-10-23,To watch environment health form environmental class dream sense race though good.
V1306,Nielsen Inc,Steven Hernandez,nielsen.inc49@example.com,+1-752-570-2969x94463,"115 Lloyd Forks Suite 216, Ryanfort, WY 32375",Ingredients & Additives,OPEN_IN_PROGRESS,2023-09-19,2024-10-25T18:13:31.345025,2.0,2026-10-06,Six law we foreign area pass computer become father at contain pattern campaign.
V1307,Jackson Group,Matthew Kim,jackson.group5@example.com,629.270.7379x455,"94039 Bryan Tunnel, New Joshuashire, IL 37748",Ingredients & Additives,OPEN_IN_PROGRESS,2023-03-16,2024-12-30T18:13:31.345248,3.9,2025-10-23,List red my executive nothing quality site carry who audience rate foreign growth.
V1308,Gillespie and Sons,Chad West,gillespie.and.sons9@example.com,220.347.8865x29889,"USCGC Pierce, FPO AE 11210",Manufacturing Equipment,OPEN_IN_PROGRESS,2023-10-19,2025-02-26T18:13:31.345442,3.7,2025-12-26,Appear not of she lay conference suffer be situation magazine phone senior new nature garden interest build question.
V1309,Kelly PLC,Mr. Michael Davis,kelly.plc46@example.com,(535)880-8044x502,"1217 Dawson Rapids Apt. 632, North Sandra, NV 91706",IT Services,OPEN_IN_PROGRESS,2025-05-22,2025-02-07T18:13:31.345683,2.8,2027-03-19,Debate item size two politics my technology network film magazine receive message arm respond manage gas live.
V1310,Montoya-Larsen,Laura Wallace,montoya-larsen33@example.com,(793)442-6725x9900,"2905 Thornton Hills Apt. 860, Port Kevin, NC 49494",Marketing & Advertising,COMPLETED_ONBOARDED,2024-02-12,2025-04-03T18:13:31.345957,2.3,2027-07-31,Couple keep small nature Mrs street idea behavior sister way product form option memory meet.
V1311,Gonzales Group,Michael Anderson,gonzales.group2@example.com,+1-273-736-5757x7433,"857 Thompson Tunnel, West Edgarview, VI 34785",Manufacturing Equipment,YET_TO_RESPOND,2025-07-04,2025-04-25T18:13:31.346192,3.3,2027-07-19,Me design realize student compare ago unit and necessary decide history.
V1312,Barajas-Faulkner,William Vaughan,barajas-faulkner23@example.com,001-482-372-8043x874,"68156 Marshall Drives, Port Whitneyborough, IA 56862",Ingredients & Additives,COMPLETED_ONBOARDED,2024-11-21,2025-04-15T18:13:31.346471,1.0,2026-10-27,Amount sport defense up sense wall father believe everything sure above kind raise week guess reveal area painting.
V1313,"Smith, Phelps and Spencer",Yvonne Hernandez,smith.phelps.and.spencer18@example.com,+1-335-579-1969x230,"98797 Samuel Squares Apt. 942, Reyesfurt, VT 89775",Ingredients & Additives,OPEN_IN_PROGRESS,2025-05-18,2025-06-17T18:13:31.346781,1.1,2027-06-30,Hard everybody their experience technology friend develop society program act sort study view system he nice enjoy kitchen.
V1314,Perez-Cummings,Eric Mathews,perez-cummings47@example.com,541-311-9871x9206,"0530 Thomas Island, Hernandeztown, NJ 82964",Manufacturing Equipment,OPEN_IN_PROGRESS,2023-02-09,2025-06-23T18:13:31.347055,1.5,2027-05-24,Late foot back reveal describe decade business early election computer from yourself may rate his hear.
V1315,"Thompson, Bautista and Reynolds",Adam Bowman,thompson.bautista.and.reynolds37@example.com,871.588.0982,"651 William Mount Apt. 488, East Nancyland, PW 95856",Contract Manufacturing,COMPLETED_ONBOARDED,2023-11-27,2025-05-25T18:13:31.347352,1.8,2027-01-10,Leg picture there Mrs son report wind resource computer sit lawyer be produce shoulder bill wait everybody ten approach.
V1316,Huffman-Simmons,Tommy Thompson,huffman-simmons35@example.com,+1-217-534-1146,"1141 Wu Via, Christophertown, GA 02639",Manufacturing Equipment,YET_TO_RESPOND,2024-05-07,2025-04-15T18:13:31.347616,1.3,2027-04-04,Television big ask its continue few example any create central born call stage nice contain born significant enter.
V1317,Barnes-Barrera,Matthew Simon,barnes-barrera15@example.com,(947)362-5179x6928,"4439 John Terrace, Patriciachester, ME 58487",IT Services,COMPLETED_ONBOARDED,2025-09-26,2025-08-12T18:13:31.347871,3.6,2026-03-01,Position conference task three general remain science agreement operation send issue mission seven cup nature moment.
V1318,Garrison Group,Candice Miller,garrison.group48@example.com,(701)585-0079x667,"22282 Anderson Flat Suite 852, Rogersshire, ND 82994",Raw Materials (Produce),COMPLETED_ONBOARDED,2023-12-27,2025-04-23T18:13:31.348121,3.7,2026-12-04,Now go her box value tend say look political.
V1319,Castaneda and Sons,Michael Coffey,castaneda.and.sons23@example.com,(399)982-3677x23695,"05864 Sean Lock, Martinborough, NM 80701",Manufacturing Equipment,YET_TO_RESPOND,2023-04-09,2025-05-24T18:13:31.348356,3.4,2027-09-14,Sure single prepare up view near just or class hotel me along.
